{
  "pack_id": "arky:policy/eu@v1",
  "version": "1.0.0",
  "rules": {
    "privacy": {
      "no_pii": true,
      "data_residency": "EU"
    },
    "attestation": {
      "required": true,
      "types": [
        "arky:attest/rats.eat@v1"
      ]
    }
  },
  "overlays": {},
  "ts": "2025-10-15T00:00:00Z",
  "sig": "eyJhbGciOiJFZERTQSIsInR5cCI6IkpXUyIsImtpZCI6InRlc3Qta2V5LTIwMjUtMDEifQ.eyJvdmVybGF5cyI6e30sInBhY2tfaWQiOiJhcmt5OnBvbGljeS9ldUB2MSIsInJ1bGVzIjp7ImF0dGVzdGF0aW9uIjp7InJlcXVpcmVkIjp0cnVlLCJ0eXBlcyI6WyJhcmt5OmF0dGVzdC9yYXRzLmVhdEB2MSJdfSwicHJpdmFjeSI6eyJkYXRhX3Jlc2lkZW5jeSI6IkVVIiwibm9fcGlpIjp0cnVlfX0sInRzIjoiMjAyNS0xMC0xNVQwMDowMDowMFoiLCJ2ZXJzaW9uIjoiMS4wLjAifQ.tUn-0uUt4_uLrJ8W6nS6bFUk27FGpHXxMf23B63O2hvCF2GE4R-HLD1oYDR4XrEAvSbxFIbvftUX1q56AbTwDw"
}
