{
  "pack_id": "arky:policy/global@v1",
  "version": "1.0.0",
  "rules": {
    "tim": {
      "numeric_units_required": true,
      "min_witnesses": 2,
      "privacy": {
        "no_pii": true
      }
    },
    "notary": {
      "finality": {
        "default_depths": {
          "caip2:eip155:1": 64,
          "solana:mainnet": 150
        }
      },
      "dtn_ordering": true
    },
    "attestation": {
      "required": false,
      "types": [
        "arky:attest/rats.eat@v1"
      ]
    },
    "revocations": {
      "enforce": true
    }
  },
  "overlays": {},
  "ts": "2025-10-15T00:00:00Z",
  "sig": "eyJhbGciOiJFZERTQSIsInR5cCI6IkpXUyIsImtpZCI6InRlc3Qta2V5LTIwMjUtMDEifQ.eyJvdmVybGF5cyI6e30sInBhY2tfaWQiOiJhcmt5OnBvbGljeS9nbG9iYWxAdjEiLCJydWxlcyI6eyJhdHRlc3RhdGlvbiI6eyJyZXF1aXJlZCI6ZmFsc2UsInR5cGVzIjpbImFya3k6YXR0ZXN0L3JhdHMuZWF0QHYxIl19LCJub3RhcnkiOnsiZHRuX29yZGVyaW5nIjp0cnVlLCJmaW5hbGl0eSI6eyJkZWZhdWx0X2RlcHRocyI6eyJjYWlwMjplaXAxNTU6MSI6NjQsInNvbGFuYTptYWlubmV0IjoxNTB9fX0sInJldm9jYXRpb25zIjp7ImVuZm9yY2UiOnRydWV9LCJ0aW0iOnsibWluX3dpdG5lc3NlcyI6MiwibnVtZXJpY191bml0c19yZXF1aXJlZCI6dHJ1ZSwicHJpdmFjeSI6eyJub19waWkiOnRydWV9fX0sInRzIjoiMjAyNS0xMC0xNVQwMDowMDowMFoiLCJ2ZXJzaW9uIjoiMS4wLjAifQ.OotP7YiOAzh2NhXr8Vchw1zM0hyMmijvD537NA5ffJHrXjtN5P-tsoDqs1k8WDaWm2Y1gylOs1BwgH0Vej_sAQ"
}
